{
  "opportunityId": "OPP-DEMO-001",
  "projectName": "示例隧道台车商机（非真实数据）",
  "countryCode": "CN",
  "customerId": "CUST-DEMO-001",
  "projectId": null,
  "tunnelType": "railway",
  "trolleyRequirements": {
    "length": 12,
    "quantity": null,
    "configurationIds": [],
    "notes": []
  },
  "stage": "lead",
  "estimatedAmount": {
    "amount": null,
    "currency": "CNY",
    "status": "unverified"
  },
  "nextAction": {
    "action": null,
    "dueDate": null,
    "owner": null,
    "status": "pending"
  },
  "lossReason": null,
  "status": "active",
  "versionInfo": {
    "schemaVersion": "1.0.0",
    "recordVersion": 1,
    "createdAt": null,
    "updatedAt": null
  }
}
